{
  "$schema": "https://json-schema.org/draft/2020-12/schema",
  "title": "Backlog — Ticket",
  "description": "One structured, vertically-sliced ticket from the Step-4 backlog. Meets the Definition of Ready: identity, testable acceptance criteria, known dependencies, and a verification approach. A ticket carries either a `goal` (task) or a `story` (story).",
  "type": "object",
  "required": ["id", "title", "epic", "type", "status", "spec", "depends_on", "blocks", "acceptance_criteria", "verification"],
  "anyOf": [
    { "required": ["goal"] },
    { "required": ["story"] }
  ],
  "properties": {
    "id": { "type": "string", "description": "Ticket id '<PREFIX>-<n>' (project tag, not CM-). Enabler tasks use a 1xx band." },
    "title": { "type": "string", "description": "Short imperative title." },
    "epic": { "type": "string", "description": "The epic id this ticket belongs to (matches roadmap.json)." },
    "type": {
      "type": "string",
      "enum": ["task", "story", "spike", "fix"],
      "description": "Ticket type. task -> uses `goal`; story -> uses `story`."
    },
    "subtype": {
      "type": "string",
      "enum": ["enabler"],
      "description": "Optional. 'enabler' marks a task that exists to unblock stories (data model, riskiest-assumption ticket)."
    },
    "status": {
      "type": "string",
      "enum": ["todo", "in_progress", "done", "blocked"],
      "description": "Ticket lifecycle state."
    },
    "spec": { "type": "string", "description": "Relative path to the /spec this ticket was sliced from." },
    "spec_step": { "type": "integer", "description": "Optional. Which numbered plan step in the spec this ticket implements." },
    "depends_on": {
      "type": "array",
      "description": "Ticket ids that must be done first (dependency order). Empty array if none.",
      "items": { "type": "string" }
    },
    "blocks": {
      "type": "array",
      "description": "Ticket ids this one unblocks. Empty array if none.",
      "items": { "type": "string" }
    },
    "goal": { "type": "string", "description": "Task only: one-sentence goal of the ticket." },
    "story": { "type": "string", "description": "Story only: 'As a <user>, I want <capability>, so that <benefit>.'" },
    "acceptance_criteria": {
      "type": "array",
      "description": "Testable conditions that define done. Each is independently checkable.",
      "items": { "type": "string" }
    },
    "verification": { "type": "string", "description": "How the ticket is proven — usually naming a ladder rung (e.g. 'property tests -> test rung')." },
    "decision_to_record": { "description": "Optional. A decision this ticket pins down (e.g. the riskiest-assumption rule). Free-form: a string, or a structured object capturing the rule and its rationale." },
    "plan": {
      "type": "object",
      "description": "Optional inline Plan beat for gnarly tickets — approach, ordered steps, and risks. Captured early; shape is intentionally loose."
    },
    "notes": { "type": "string", "description": "Optional supplementary notes, slicing rationale, or non-goals." }
  }
}
