{
  "id": "ETK-100",
  "title": "Data model — Task / DailyPick / Streak",
  "epic": "daily-pick-loop",
  "type": "task",
  "subtype": "enabler",
  "status": "todo",
  "spec": "specs/EPIC-daily-pick-loop.spec.md",
  "spec_step": 1,
  "depends_on": [],
  "blocks": ["ETK-1", "ETK-3", "ETK-101"],
  "goal": "Define the core domain model and its state transitions so the stories have a stable foundation to build on.",
  "acceptance_criteria": [
    "Task { id, title, createdAt } — the pool item",
    "DailyPick { date, taskId, status: drawn|done } — one per calendar day",
    "Streak { count, lastCompletedDate } with explicit increment and reset rules",
    "State transitions are unit-tested (draw -> done; missed day -> reset)",
    "The streak-reset rule is documented in code where Streak is defined"
  ],
  "verification": "Unit tests covering every transition; no UI in scope. (Ladder: test rung.)",
  "notes": "Plan step 1 of the spec. Owns the streak-reset semantics so ETK-3 can just consume them. The day-boundary rule (a separate, riskier decision) is owned by ETK-101."
}
