{
  "id": "ETK-3",
  "title": "Mark done & grow the streak",
  "epic": "daily-pick-loop",
  "type": "story",
  "status": "todo",
  "spec": "specs/EPIC-daily-pick-loop.spec.md",
  "depends_on": ["ETK-100", "ETK-2"],
  "blocks": [],
  "story": "As a user, I want to mark today's drawn task as done and see my streak grow, so that finishing a small chore feels rewarding and I keep coming back.",
  "acceptance_criteria": [
    "Marking the day's task done increments the streak by 1",
    "A day with no completed task resets the streak (per the rule fixed in ETK-100)",
    "The current streak is visible on the main screen at all times",
    "Completion is recorded for telemetry (feeds the >70% completion & 5+ streak metrics)"
  ],
  "verification": "Unit tests on streak increment/reset; component test for the done action + streak display; telemetry event asserted. (Ladder: test rung.)",
  "notes": "The streak is the only gamification in V1 (badges/levels are non-goals) — keep the loop legible. Bundles two plan steps (mark-done + streak UI) because they form a single user-observable outcome."
}
