{
  "id": "ETK-101",
  "title": "Pick engine + day-boundary rule",
  "epic": "daily-pick-loop",
  "type": "task",
  "subtype": "enabler",
  "status": "todo",
  "spec": "specs/EPIC-daily-pick-loop.spec.md",
  "spec_step": 2,
  "depends_on": ["ETK-100"],
  "blocks": ["ETK-2"],
  "goal": "Implement the deterministic-per-day random pick, and decide & pin the day-boundary rule that everything downstream assumes.",
  "decision_to_record": {
    "day_boundary": "device-local midnight? a rolling 24h from first open? server day? -> record the chosen rule and rationale here and in code.",
    "timezone_change": "what happens if the user crosses a timezone mid-day?",
    "fairness": "may the same task be drawn two days running, or is there a cooldown?"
  },
  "acceptance_criteria": [
    "Exactly one pick is produced per day under the chosen boundary rule",
    "Reopening within the same day returns the same pick (deterministic)",
    "A new day produces a new pick; the boundary behavior is covered by tests",
    "Timezone-change behavior is defined and tested (no double-pick, no skipped day)",
    "Fairness rule implemented and tested (e.g. no immediate repeat, if chosen)",
    "The streak-swap path (active streak -> one allowed swap) is supported"
  ],
  "verification": "Unit tests are the contract: same-pick-on-reopen, day rollover at the boundary, timezone-change edge cases, fairness. Pin these before any UI work in ETK-2. (Ladder: test rung.)",
  "plan": {
    "_what": "The loop's Plan beat, persisted for a gnarly enabler whose riskiest decision (the day-boundary rule) deserves writing down.",
    "approach": "Build a pure, deterministic-per-day pick function over the pool, plus the streak-swap escape hatch. Decide the day-boundary rule explicitly and pin it with tests before any UI (ETK-2) consumes it.",
    "changes_by_layer": {
      "domain": "domain/pick/ — pickForDay(pool, date, seed) (pure, deterministic); fairness rule (no immediate repeat).",
      "data": "reads the pool + today's DailyPick (from ETK-100); no new schema.",
      "frontend": "none — this enabler has no UI; ETK-2 wires it.",
      "tests": "unit only — same-pick-on-reopen, boundary rollover, timezone-change, fairness, streak-swap."
    },
    "sequence": [
      "Decide the day-boundary rule (device-local midnight vs rolling 24h) — record it here + in code -> unit tests.",
      "pickForDay deterministic selection -> unit (same-pick-on-reopen).",
      "Fairness (no immediate repeat) -> unit.",
      "Streak-swap path -> unit."
    ],
    "riskiest_assumption": "A single 'one pick per calendar day' rule is sufficient. De-risk: settle the timezone/day-boundary semantics in step 1 and lock them with tests before ETK-2 builds on them — so the rule is decided once, not re-invented across screens."
  },
  "notes": "The payoff of the whole design->spec->backlog chain. The 'one pick per day' timezone question was the spec's riskiest assumption, so instead of smearing it across the UI stories it was promoted to its own foundational ticket. This is why you spec before you slice."
}
